### ISSUE TITLE
SFTP - Unable to make a connection. Please try again

### ISSUE THREAD

**Issue by nemesisdan** [mimecuvalo/fireftp#177]
After upgrading to v2.0.27 I am unable to connect using SFTP. Any documentation on how to use the new SFTP would be helpful!

Error Message: Unable to make a connection. Please try again
Firefox version: 47.0

All my keys are valid and still work when using other FTP clients, what's changed in FireFTP?

**Comment by jan22git** [comment]
I have the same issue. Wireshark trace shows:
14	3.601355	192.168.2.32	55580	46.30.xxx.164	22	TCP	66	55580 → 22 [SYN] Seq=0 Win=8192 Len=0 MSS=1460 WS=256 SACK_PERM=1
15	3.616223	46.30.xxx.164	22	192.168.2.32	55580	TCP	66	22 → 55580 [SYN, ACK] Seq=0 Ack=1 Win=29200 Len=0 MSS=1460 SACK_PERM=1 WS=128
16	3.616314	192.168.2.32	55580	46.30.xxx.164	22	TCP	54	55580 → 22 [ACK] Seq=1 Ack=1 Win=65536 Len=0
17	3.634036	46.30.xxx.164	22	192.168.2.32	55580	SSH	96	Server: Protocol (SSH-2.0-OpenSSH_6.6.1p1 Debian-4~bpo70+1)
18	3.634898	192.168.2.32	55580	46.30.xxx.164	22	TCP	54	55580 → 22 [FIN, ACK] Seq=1 Ack=43 Win=65536 Len=0  and 2 more packet to fully close the conn.

Any ideas?

**Comment by Wendihihi** [comment]
Duplicate with #176

**Comment by mimecuvalo** [comment]
Bug is being tracked here: https://github.com/mimecuvalo/paramikojs/issues/9
Thanks for the feedback!

**Comment by mimecuvalo** [comment]
Fixed now - sorry for the inconvenience! :-/

**Comment by nemesisdan** [comment]
Fantastic! Works like a charm! Thank you very much!

**Comment by gunjahman** [comment]
Sorry guys, but I use Firefox 51.0.1 and Fireftp 2.0.31, but I can't connect via SFTP. Without sftp it is connected ok and I also tried the credentials + ppk key in Filezilla and it is working ok. Any ideas?
Here's the debug:
![debug](https://cloud.githubusercontent.com/assets/25682828/22820568/0012e94c-ef80-11e6-9e60-cd729454cf6c.jpg)
